{
    "recurrent_regions": [
      {
        "name": "d1",
        "num_units": 50,
        "base_firing": 0,
        "sign": "neg"
      },
      {
        "name": "d2",
        "num_units": 50,
        "base_firing": 0,
        "sign": "neg"
      },
      {
        "name": "gpe",
        "num_units": 50,
        "base_firing": 1,
        "init": 1,
        "sign": "neg"
      },
      {
        "name": "stn",
        "num_units": 50,
        "base_firing": 1,
        "init": 0,
        "sign": "pos"
      },
      {
        "name": "snr",
        "num_units": 50,
        "base_firing": 1,
        "init": 1,
        "sign": "neg"
      },
      {
        "name": "thal",
        "num_units": 50,
        "base_firing": 1,
        "sign": "pos"
      },
      {
        "name": "alm_exc",
        "num_units": 40,
        "base_firing": 0,
        "sign": "pos"
      },
      {
        "name": "alm_inhib",
        "num_units": 10,
        "base_firing": 0,
        "sign": "neg"
      }
    ],
    "recurrent_connections": [
      {
        "src_region": "d1",
        "dst_region": "d1",
        "sparsity": 0.9
      },
      {
        "src_region": "d1",
        "dst_region": "d2",
        "sparsity": 0.9
      },
      {
        "src_region": "d2",
        "dst_region": "d1",
        "sparsity": 0.9
      },
      {
        "src_region": "d2",
        "dst_region": "d2",
        "sparsity": 0.9
      },
      {
        "src_region": "d2",
        "dst_region": "gpe",
        "sparsity": 0.25
      },
      {
        "src_region": "d1",
        "dst_region": "snr",
        "sparsity": 0.25
      },
      {
        "src_region": "gpe",
        "dst_region": "stn",
        "sparsity": 0.25
      },
      {
        "src_region": "stn",
        "dst_region": "snr",
        "sparsity": 0.25
      },
      {
        "src_region": "snr",
        "dst_region": "thal",
        "sparsity": 0.25
      },
      {
        "src_region": "thal",
        "dst_region": "d1",
        "sparsity": 0.25
      },
      {
        "src_region": "thal",
        "dst_region": "d2",
        "sparsity": 0.25
      },
      {
        "src_region": "thal",
        "dst_region": "alm_exc",
        "sparsity": 0.25
      },
      {
        "src_region": "thal",
        "dst_region": "alm_inhib",
        "sparsity": 0.25
      },
      {
        "src_region": "alm_exc",
        "dst_region": "alm_exc",
        "sparsity": 0.25
      },
      {
        "src_region": "alm_exc",
        "dst_region": "alm_inhib",
        "sparsity": 0.25
      },
      {
        "src_region": "alm_inhib",
        "dst_region": "alm_inhib",
        "sparsity": 0.25
      },
      {
        "src_region": "alm_inhib",
        "dst_region": "alm_exc",
        "sparsity": 0.25
      },
      {
        "src_region": "alm_exc",
        "dst_region": "d1",
        "sparsity": 0.25
      },
      {
        "src_region": "alm_exc",
        "dst_region": "d2",
        "sparsity": 0.25
      }
    ],
    "input_regions": [
      {
        "num_units": 25,
        "name": "iti",
        "sign": "pos"
      }
    ],
    "input_connections": [
      {
        "src_region": "iti",
        "dst_region": "d1",
        "sparsity": 0.25
      },
      {
        "src_region": "iti",
        "dst_region": "d2",
        "sparsity": 0.25
      }
    ]
  }